<?xml version="1.0"?>

<molsim xmlns:xsi="http://www.w3.org/2001/XMLSchema-instance"
        xsi:noNamespaceSchemaLocation="src/XMLReader/MolSim.xsd">

    <input_file>../input.txt</input_file>

    <delta_t>0.0005</delta_t>

    <end_time>10</end_time>

    <output_step>50</output_step>

    <epsilon>5</epsilon>

    <sigma>1</sigma>

    <gravity>-0.8</gravity>

    <averageV>0.7</averageV>

    <algorithm>lj</algorithm>

    <simulationContainer>
        <boundaryConditions>
            <xBoundary>0</xBoundary>
            <yBoundary>2</yBoundary>
            <zBoundary>2</zBoundary>
        </boundaryConditions>
        <dimension>
            <x>30</x>
            <y>30</y>
            <z>12</z>
        </dimension>
        <mesh>3</mesh>
        <cutOff>3</cutOff>
        <containerAlgorithm>linkedCells</containerAlgorithm>
    </simulationContainer>

    <particles>

        <Cube>
            <dimension>
                <x>20</x>
                <y>25</y>
                <z>10</z>
            </dimension>
            <startPoint>
                <x>6.2</x>
                <y>4</y>
                <z>4</z>
            </startPoint>
            <h>1.2</h>
            <mass>1</mass>
            <velocity>
                <x>0</x>
                <y>0</y>
                <z>0</z>
            </velocity>
            <epsilon>1</epsilon>
            <sigma>1</sigma>
            <fixed>false</fixed>
        </Cube>
        <Cube>
            <dimension>
                <x>2</x>
                <y>30</y>
                <z>12</z>
            </dimension>
            <startPoint>
                <x>4</x>
                <y>4</y>
                <z>4</z>
            </startPoint>
            <h>1</h>
            <mass>1</mass>
            <velocity>
                <x>0</x>
                <y>0</y>
                <z>0</z>
            </velocity>
            <epsilon>2</epsilon>
            <sigma>1.1</sigma>
            <fixed>true</fixed>
        </Cube>
        <Cube>
            <dimension>
                <x>2</x>
                <y>30</y>
                <z>12</z>
            </dimension>
            <startPoint>
                <x>30.2</x>
                <y>4</y>
                <z>4</z>
            </startPoint>
            <h>1</h>
            <mass>1</mass>
            <velocity>
                <x>0</x>
                <y>0</y>
                <z>0</z>
            </velocity>
            <epsilon>2</epsilon>
            <sigma>1.1</sigma>
            <fixed>true</fixed>
        </Cube>
    </particles>

    <thermostats>
        <initialTemperature>40</initialTemperature>
        <targetTemperature>10</targetTemperature>
        <maxDelta>-1</maxDelta>
        <stepSize>1000</stepSize>
    </thermostats>

    <parallelizationStrategy>1</parallelizationStrategy>

    <simulationType>simuFlow</simulationType>

    <benchmark>no</benchmark>

</molsim>